{
  "application_layouts": {
    "0x018f": {
      "application_size_bytes": 8,
      "zero_application_events": 28
    },
    "0x0190": {
      "application_size_bytes": 104,
      "key_dword_offsets": [
        0,
        4
      ],
      "record_dword_count": 16,
      "record_dword_offset_first": 8,
      "record_dword_offset_last": 68,
      "unread_tail_offset": 72,
      "unread_tail_size_bytes": 32
    },
    "0x0191": {
      "application_size_bytes": 8,
      "zero_application_events": 28
    }
  },
  "boundaries": [
    "Canonical capture membership is matched to the pcap-1.23b manifest before clear port-54992 lane admission; the repository gate verifies member hashes.",
    "Transactions are segmented only within one reconstructed s2c lane and increasing wrapped-event order.",
    "Key dwords are reported only through equality and multiplicity aggregates because their meanings are unproven.",
    "Vector values are unsigned wire dwords; only the bounded 0 through 255 distribution is enumerated.",
    "Nearest and intervening opcodes establish same-lane context, not causality.",
    "Inventory, equipment-carrier, and change-frame overlap means numeric opcode presence inside a span, not a state transition.",
    "Imported MassSetItemModifier names are not used as evidence or assigned to these packets."
  ],
  "contexts": {
    "intervening_non_target_opcodes": {},
    "nearest_same_lane_opcodes": {
      "next/0x0001": 3,
      "next/0x00ca": 2,
      "next/0x00cf": 2,
      "next/0x00db": 1,
      "next/0x0137": 9,
      "next/0x0139": 2,
      "next/0x0144": 3,
      "next/0x0169": 3,
      "next/0x017a": 1,
      "next/0x018d": 1,
      "next/0x0195": 1,
      "prior/0x0001": 9,
      "prior/0x000c": 2,
      "prior/0x00cf": 3,
      "prior/0x00d3": 1,
      "prior/0x0130": 1,
      "prior/0x0137": 3,
      "prior/0x0139": 2,
      "prior/0x016e": 2,
      "prior/0x0177": 1,
      "prior/0x017a": 1,
      "prior/0x018b": 2,
      "prior/0x0195": 1
    },
    "spans_with_change_frame_overlap": 0,
    "spans_with_equipment_carrier_overlap": 0,
    "spans_with_inventory_frame_overlap": 0
  },
  "corpus": {
    "admitted_chat_lanes": 30,
    "admitted_lanes": 84,
    "admitted_main_lanes": 54,
    "captures": 54,
    "complete_spans": 28,
    "compressed_frame_inflate_failures": 0,
    "records_in_complete_spans": 5569,
    "retransmitted_segments": 1759,
    "source_manifest": "sources/pcap-1.23b/manifest.yaml",
    "subevent_truncations": 0,
    "target_c2s_0x018f": 0,
    "target_c2s_0x0190": 0,
    "target_c2s_0x0191": 0,
    "target_s2c_0x018f": 28,
    "target_s2c_0x0190": 5569,
    "target_s2c_0x0191": 28,
    "unparsed_frame_body_bytes": 0,
    "wrapped_short_inner_headers": 0
  },
  "exclusions": {
    "unexpected_application_shape": 0,
    "unexpected_subevent_size": 0
  },
  "key_distributions": {
    "equal_key_dwords": 0,
    "key_dword_0": {
      "distinct_values": 206,
      "events": 5569,
      "maximum_multiplicity": 28,
      "multiplicity_histogram": {
        "1": 2,
        "19": 1,
        "21": 1,
        "24": 1,
        "25": 1,
        "27": 1,
        "28": 194,
        "3": 1,
        "4": 4
      },
      "repeated_events_beyond_first": 5363,
      "repeated_values": 204,
      "singleton_values": 2,
      "zero_events": 0
    },
    "key_dword_1": {
      "distinct_values": 1,
      "events": 5569,
      "maximum_multiplicity": 5569,
      "multiplicity_histogram": {
        "5569": 1
      },
      "repeated_events_beyond_first": 5568,
      "repeated_values": 1,
      "singleton_values": 0,
      "zero_events": 5569
    },
    "key_pairs": {
      "distinct_values": 206,
      "events": 5569,
      "maximum_multiplicity": 28,
      "multiplicity_histogram": {
        "1": 2,
        "19": 1,
        "21": 1,
        "24": 1,
        "25": 1,
        "27": 1,
        "28": 194,
        "3": 1,
        "4": 4
      },
      "repeated_events_beyond_first": 5363,
      "repeated_values": 204,
      "singleton_values": 2,
      "zero_events": 0
    }
  },
  "per_capture": {
    "accept_leve.pcapng": {
      "admitted_lanes": 2,
      "complete_spans": 0,
      "exclusions": {},
      "issues": {},
      "records_in_complete_spans": 0,
      "retransmitted_segments": 24,
      "target_0x018f": 0,
      "target_0x0190": 0,
      "target_0x0191": 0
    },
    "accept_local_leve.pcapng": {
      "admitted_lanes": 1,
      "complete_spans": 0,
      "exclusions": {},
      "issues": {},
      "records_in_complete_spans": 0,
      "retransmitted_segments": 17,
      "target_0x018f": 0,
      "target_0x0190": 0,
      "target_0x0191": 0
    },
    "accept_quest.pcapng": {
      "admitted_lanes": 2,
      "complete_spans": 0,
      "exclusions": {},
      "issues": {},
      "records_in_complete_spans": 0,
      "retransmitted_segments": 16,
      "target_0x018f": 0,
      "target_0x0190": 0,
      "target_0x0191": 0
    },
    "action_and_traits.pcapng": {
      "admitted_lanes": 1,
      "complete_spans": 0,
      "exclusions": {},
      "issues": {},
      "records_in_complete_spans": 0,
      "retransmitted_segments": 20,
      "target_0x018f": 0,
      "target_0x0190": 0,
      "target_0x0191": 0
    },
    "add_str.pcapng": {
      "admitted_lanes": 1,
      "complete_spans": 0,
      "exclusions": {},
      "issues": {},
      "records_in_complete_spans": 0,
      "retransmitted_segments": 11,
      "target_0x018f": 0,
      "target_0x0190": 0,
      "target_0x0191": 0
    },
    "attributes.pcapng": {
      "admitted_lanes": 1,
      "complete_spans": 0,
      "exclusions": {},
      "issues": {},
      "records_in_complete_spans": 0,
      "retransmitted_segments": 16,
      "target_0x018f": 0,
      "target_0x0190": 0,
      "target_0x0191": 0
    },
    "battle_mode_passive_mode.pcapng": {
      "admitted_lanes": 2,
      "complete_spans": 0,
      "exclusions": {},
      "issues": {},
      "records_in_complete_spans": 0,
      "retransmitted_segments": 5,
      "target_0x018f": 0,
      "target_0x0190": 0,
      "target_0x0191": 0
    },
    "buy_square_maple_shield.pcapng": {
      "admitted_lanes": 2,
      "complete_spans": 0,
      "exclusions": {},
      "issues": {},
      "records_in_complete_spans": 0,
      "retransmitted_segments": 22,
      "target_0x018f": 0,
      "target_0x0190": 0,
      "target_0x0191": 0
    },
    "change_bodyarmor.pcapng": {
      "admitted_lanes": 1,
      "complete_spans": 0,
      "exclusions": {},
      "issues": {},
      "records_in_complete_spans": 0,
      "retransmitted_segments": 19,
      "target_0x018f": 0,
      "target_0x0190": 0,
      "target_0x0191": 0
    },
    "change_helm.pcapng": {
      "admitted_lanes": 1,
      "complete_spans": 0,
      "exclusions": {},
      "issues": {},
      "records_in_complete_spans": 0,
      "retransmitted_segments": 28,
      "target_0x018f": 0,
      "target_0x0190": 0,
      "target_0x0191": 0
    },
    "change_to_botanist.pcapng": {
      "admitted_lanes": 2,
      "complete_spans": 0,
      "exclusions": {},
      "issues": {},
      "records_in_complete_spans": 0,
      "retransmitted_segments": 21,
      "target_0x018f": 0,
      "target_0x0190": 0,
      "target_0x0191": 0
    },
    "chat_say.pcapng": {
      "admitted_lanes": 1,
      "complete_spans": 0,
      "exclusions": {},
      "issues": {},
      "records_in_complete_spans": 0,
      "retransmitted_segments": 6,
      "target_0x018f": 0,
      "target_0x0190": 0,
      "target_0x0191": 0
    },
    "chat_shout.pcapng": {
      "admitted_lanes": 1,
      "complete_spans": 0,
      "exclusions": {},
      "issues": {},
      "records_in_complete_spans": 0,
      "retransmitted_segments": 3,
      "target_0x018f": 0,
      "target_0x0190": 0,
      "target_0x0191": 0
    },
    "check_room_map.pcapng": {
      "admitted_lanes": 1,
      "complete_spans": 0,
      "exclusions": {},
      "issues": {},
      "records_in_complete_spans": 0,
      "retransmitted_segments": 17,
      "target_0x018f": 0,
      "target_0x0190": 0,
      "target_0x0191": 0
    },
    "checkbed.pcapng": {
      "admitted_lanes": 1,
      "complete_spans": 0,
      "exclusions": {},
      "issues": {},
      "records_in_complete_spans": 0,
      "retransmitted_segments": 5,
      "target_0x018f": 0,
      "target_0x0190": 0,
      "target_0x0191": 0
    },
    "coerthas_map.pcapng": {
      "admitted_lanes": 2,
      "complete_spans": 0,
      "exclusions": {},
      "issues": {},
      "records_in_complete_spans": 0,
      "retransmitted_segments": 10,
      "target_0x018f": 0,
      "target_0x0190": 0,
      "target_0x0191": 0
    },
    "combat_autoattack.pcapng": {
      "admitted_lanes": 2,
      "complete_spans": 2,
      "exclusions": {},
      "issues": {},
      "records_in_complete_spans": 400,
      "retransmitted_segments": 14,
      "target_0x018f": 2,
      "target_0x0190": 400,
      "target_0x0191": 2
    },
    "combat_skills.pcapng": {
      "admitted_lanes": 1,
      "complete_spans": 1,
      "exclusions": {},
      "issues": {},
      "records_in_complete_spans": 200,
      "retransmitted_segments": 11,
      "target_0x018f": 1,
      "target_0x0190": 200,
      "target_0x0191": 1
    },
    "cutscene_book.pcapng": {
      "admitted_lanes": 2,
      "complete_spans": 0,
      "exclusions": {},
      "issues": {},
      "records_in_complete_spans": 0,
      "retransmitted_segments": 88,
      "target_0x018f": 0,
      "target_0x0190": 0,
      "target_0x0191": 0
    },
    "emote_dance.pcapng": {
      "admitted_lanes": 2,
      "complete_spans": 0,
      "exclusions": {},
      "issues": {},
      "records_in_complete_spans": 0,
      "retransmitted_segments": 20,
      "target_0x018f": 0,
      "target_0x0190": 0,
      "target_0x0191": 0
    },
    "emote_kneel.pcapng": {
      "admitted_lanes": 1,
      "complete_spans": 0,
      "exclusions": {},
      "issues": {},
      "records_in_complete_spans": 0,